[
    {
        "key": "test",
        "title": "some-title",
        "path": "test:createdOn",
        "displayType": {
            "type": "date",
            "displayTypeParameters": {
                "dateFormat": "yyyy-MM-dd"
            }
        },
        "sortable": false,
        "defaultSort": "DESC",
        "order": 0
    },
    {
        "key": "modifiedOn",
        "path": "test:modifiedOn",
        "displayType": {
            "type": "date",
            "displayTypeParameters": {
                "dateFormat": null
            }
        },
        "sortable": true
    }
]